{
  "schema_version": 2,
  "eintrag_id": "cb2f3b04-f65a-4149-8bd7-26695931e4e3",
  "auftrag_id": "88e580f5-59ad-449c-accf-a4c967aa9fc9",
  "uebergeordneter_auftrag": null,
  "ereignis": "zwischenstand",
  "zeitpunkt": "2026-09-23T12:43:21Z",
  "arbeitszeitraum": {
    "von": null,
    "bis": "2026-09-23T12:43:21Z",
    "zeitquelle": "systemuhr",
    "hinweis": "Nach Speicherung durch den Inhaber erfolgte lesende Rückprüfung; der genaue Beginn der ersten Lesehandlung wurde nicht aufgezeichnet."
  },
  "akteur": {
    "bezeichnung": "ChatGPT",
    "typ": "ki",
    "rolle": "Nachprüfung der vom Inhaber aktivierten Schutzregel im fortgesetzten Abschlussauftrag"
  },
  "vorgaenger": ["bd55eda9-2eb4-4ffc-9023-520e13590235"],
  "korrektur_fuer": [],
  "auftrag": {
    "quelle": "https://github.com/ismailkantarci/Gesellschaftsrecht/issues/2",
    "zusammenfassung": "Der Inhaber hat das zuvor geprüfte Ruleset gespeichert und die gespeicherte Ansicht übermittelt. Fortsetzung der beauftragten Schutzabnahme, keine neue Facharbeit.",
    "erlaubter_umfang": [
      "Gespeichertes Ruleset und tatsächlichen Branchstatus zurücklesen",
      "Den bestehenden Abschlussauftrag nachvollziehbar fortschreiben und Veröffentlichung über einen geprüften PR durchführen"
    ],
    "ausgeschlossen": [
      "Keine Änderung oder Umgehung der aktivierten Regeln",
      "Keine Lösch- oder Force-Push-Probe an main",
      "Keine vertraulichen Daten, neuen Fachmodelle oder Änderungen anderer Repositorys"
    ]
  },
  "basis": {
    "commit": "bea4e6678d56ac76bda03676a8eb3e122e60155f",
    "quellen": [
      "AGENTS.md",
      "09_arbeitsjournal/schutz_und_betrieb.md",
      "09_arbeitsjournal/schema_v2.json",
      "https://api.github.com/repos/ismailkantarci/Gesellschaftsrecht/rulesets/23879295"
    ]
  },
  "taetigkeiten": [
    "Ruleset 23879295 direkt über die GitHub-Verbindung zurückgelesen: active, nur refs/heads/main, leere Bypass-Liste und current_user_can_bypass=never.",
    "PR-Pflicht, Merge-Methode merge, null vorgeschriebene Review-Zustimmungen, Gesprächsauflösung und Statuscheck journal mit GitHub-Actions-App-ID 15368 sowie strikte Aktualität verifiziert.",
    "Löschschutz und non_fast_forward-Regel verifiziert; Branchliste meldet main protected=true. Erstellzeit der Serverregel: 2026-09-23T14:37:01.149+02:00.",
    "Zwei frühere Pflegezweige weiterhin vorhanden; direkte Zweiglöschung ist in den verfügbaren Aktionen nicht enthalten. Keine erfolgte Bereinigung behauptet.",
    "Die Prüfung betrifft nur den tatsächlichen Konfigurationsstand. Ein negativer Mergeversuch wurde nicht durchgeführt."
  ],
  "ergebnisse": ["https://github.com/ismailkantarci/Gesellschaftsrecht/rules/23879295"],
  "aenderungen": [],
  "pruefungen": [
    {
      "verfahren": "Rücklesen gespeicherter Regel und des Branchstatus",
      "ergebnis": "bestanden",
      "zeitpunkt": "2026-09-23T12:43:21Z",
      "bezug": [
        "https://api.github.com/repos/ismailkantarci/Gesellschaftsrecht/rulesets/23879295",
        "https://api.github.com/repos/ismailkantarci/Gesellschaftsrecht/branches"
      ],
      "grenze": "Konfiguration und aktuelle fehlende Bypass-Befugnis der Verbindung bestätigt. Kein Nachweis gegen jede spätere administrative Änderung oder gleichzeitige Manipulation von Prüfer und Workflow."
    }
  ],
  "entscheidungen": ["05_entscheidungen/ent_0003_selbstbeschreibung_und_qualitaet.md"],
  "offen": [
    {
      "punkt": "Verhalten unter aktiver Regel noch am konkreten PR auszuwerten",
      "naechste_handlung": "Einen echten Journal-PR verwenden, seinen Head und Checkzustand lesen und nur nach bestandenem Check regulär mergen. Keine ungültigen Testdaten nach main übertragen.",
      "verantwortung": "Beauftragte Bearbeitung",
      "ausloeser": "Veröffentlichung dieses Zwischenstands"
    },
    {
      "punkt": "Zwei vollständig übernommene Pflegezweige stehen noch zur Bereinigung an",
      "naechste_handlung": "Nach letzter Übernahme und erneuter Nutzungsprüfung durch den Inhaber löschen; keinen neuen Pflegezweig nur für diesen Verifikationsnachtrag anlegen.",
      "verantwortung": "Repository-Inhaber; direkte Löschaktion im Connector nicht verfügbar",
      "ausloeser": "Erfolgreicher Abschluss des bestehenden Abschlussauftrags"
    }
  ],
  "fortsetzung": {
    "verfolgungsort": "https://github.com/ismailkantarci/Gesellschaftsrecht/issues/2",
    "naechste_handlung": "Aktivierung nicht erneut durchführen. Den bestehenden, noch nicht abschließend bereinigten Abschlussauftrag mit diesem Nachtrag fortsetzen; PR-/Checkauswertung und verbleibende Bereinigung ausdrücklich getrennt behandeln.",
    "einstieg": ["AGENTS.md", "09_arbeitsjournal/schutz_und_betrieb.md"]
  },
  "grenzen": [
    "Der Inhaber hat die Regel aktiviert, nicht die GitHub-Verbindung von ChatGPT.",
    "Frühere Aussagen über fehlende Aktivierung bleiben historische Beobachtungen, gelten aber nicht mehr als heutiger Serverzustand.",
    "Dieser Bericht ist kein abgeschlossener Fachtest und kein Beweis einer bereits erfolgten Zweiglöschung.",
    "Die eigene PR-Veröffentlichung und deren Checks liegen zum Erfassungszeitpunkt noch nicht vor."
  ]
}
