{
  "schema_version": 2,
  "eintrag_id": "5239f44c-20c2-4592-87fa-3d53c3e2f2cf",
  "auftrag_id": "88e580f5-59ad-449c-accf-a4c967aa9fc9",
  "uebergeordneter_auftrag": null,
  "ereignis": "zwischenstand",
  "zeitpunkt": "2026-09-23T09:37:43Z",
  "arbeitszeitraum": {
    "von": "2026-09-23T09:30:52Z",
    "bis": "2026-09-23T09:37:43Z",
    "zeitquelle": "systemuhr",
    "hinweis": "Erneuter Auftrag zur Vervollständigung; Beginn des hier beobachteten Laufzeitabschnitts, keine rückwirkende Präzisierung früherer Arbeit."
  },
  "akteur": {
    "bezeichnung": "ChatGPT",
    "typ": "ki",
    "rolle": "Beauftragte Wiederaufnahme mit Inhalts- und Veröffentlichungsprüfung"
  },
  "vorgaenger": [
    "8a11389e-373c-4cd5-84d5-2b8b4aaa141b"
  ],
  "korrektur_fuer": [],
  "auftrag": {
    "quelle": "https://github.com/ismailkantarci/Gesellschaftsrecht/issues/2",
    "zusammenfassung": "Der Auftraggeber hat erneut ausdrücklich die Vervollständigung der offenen Veröffentlichung und Absicherung mit derselben Prüfsorgfalt beauftragt. Fortsetzung des bestehenden Auftrags, keine fachliche Neuausrichtung.",
    "erlaubter_umfang": [
      "Vollständiges vorbereitetes Qualitätspaket prüfen und regulär über den vorhandenen Arbeitszweig und PR veröffentlichen",
      "Tatsächliche Prüfungen und offene Administrationsgrenze nachvollziehbar dokumentieren"
    ],
    "ausgeschlossen": [
      "Keine Rechte- oder Sicherheitsumgehung, kein Force-Push und keine fremden Repository-Änderungen",
      "Keine vertraulichen Originale, keine erfundenen Freigaben oder Prüfer"
    ]
  },
  "basis": {
    "commit": "16f8c859a72db4801e5b854d7e11bd440d3020cc",
    "quellen": [
      "README.md",
      "AGENTS.md",
      "09_arbeitsjournal/README.md",
      "05_entscheidungen/ent_0003_selbstbeschreibung_und_qualitaet.md"
    ]
  },
  "taetigkeiten": [
    "Aktuellen main 918b6157ef123645bcc760e189041daeb9a43849 und Arbeitszweig 16f8c859a72db4801e5b854d7e11bd440d3020cc zurückgelesen; keine zwischenzeitliche fremde Inhaltsänderung beobachtet.",
    "67 Paketdateien anhand SHA-256 und Git-Blob-Werten geprüft; Patch rückwärts auf exakten Basisbaum aa41b2ba216bfc8e316d12f84b2749069f05c472 angewandt. Die für die lokale Herkunftsprüfung benötigten zwei Commitobjekte aus beobachteten Metadaten hashidentisch rekonstruiert.",
    "Alle 46 gepflegten Selbsttests in diesem Auftrag erneut ausgeführt; Journal-/Herkunfts-/Append-only-Prüfung des vollständigen Pakets erneut bestanden.",
    "Die zuvor fehlenden README-/AGENTS-Inhalte und das historische Blockadeereignis über reguläre GitHub-create_tree-Aufrufe übertragen. Remote-Paketbaum e2b790139d520940182b2c0e9749c99071b198d4 stimmt exakt mit dem übergebenen Manifest überein.",
    "Branchschutz erneut angefragt: 403 Resource not accessible by integration. Ruleset-Liste leer. Verfügbare Plugin-Funktionen überprüft: kein administrativer Schreibweg. Keine abweichende Identität oder zusätzliche Geheimnisse verwendet."
  ],
  "ergebnisse": [
    "00_systemkern/selbstbeschreibung.md",
    "09_arbeitsjournal/schema_v2.json",
    "09_arbeitsjournal/schutz_und_betrieb.md"
  ],
  "aenderungen": [],
  "pruefungen": [
    {
      "verfahren": "Wiederholung der 46 gepflegten Positiv-/Negativtests und vollständige Paketprüfung",
      "ergebnis": "bestanden",
      "zeitpunkt": "2026-09-23T09:34:48Z",
      "bezug": [
        "09_arbeitsjournal/selbsttest.py",
        "09_arbeitsjournal/pruefen.py"
      ],
      "grenze": "Prüfbaum e2b790139d520940182b2c0e9749c99071b198d4, acht Ereignisse; keine neue ferne Workflow-Ausführung in diesem Eintrag behauptet. Selbstprüfung, keine unabhängige Fachprüfung."
    }
  ],
  "entscheidungen": [
    "05_entscheidungen/ent_0003_selbstbeschreibung_und_qualitaet.md"
  ],
  "offen": [
    {
      "punkt": "Vollständiger Paketbaum noch nicht auf main veröffentlicht",
      "naechste_handlung": "Vorhandenen Arbeitszweig auf journalisierten Kandidaten aktualisieren; PR prüfen, echte Checks abwarten und exakt geprüften Head regulär mergen.",
      "verantwortung": "Beauftragte Bearbeitung",
      "ausloeser": "Dieser Fortsetzungsauftrag"
    },
    {
      "punkt": "Serverseitiger Branchschutz administrativ nicht aktivierbar",
      "naechste_handlung": "Repository-Inhaber muss über eigenen berechtigten Verwaltungszugriff die vorbereitete Regel anwenden; danach aktive Regel und Sperrwirkung überprüfen.",
      "verantwortung": "Repository-Inhaber oder befugte Administration",
      "ausloeser": "Verfügbarer Administrationszugriff"
    }
  ],
  "fortsetzung": {
    "verfolgungsort": "https://github.com/ismailkantarci/Gesellschaftsrecht/issues/2",
    "naechste_handlung": "Den hashgeprüften vollständigen Kandidaten per PR veröffentlichen; tatsächliche Ergebnisse nachtragen. Administrationspunkt getrennt offen halten.",
    "einstieg": [
      "README.md",
      "AGENTS.md",
      "09_arbeitsjournal/schutz_und_betrieb.md"
    ]
  },
  "grenzen": [
    "Vorbereitete Git-Baumobjekte sind noch kein auf main veröffentlichter Inhalt.",
    "Der Kandidat bewahrt alle acht ursprünglichen Journalereignisse unverändert; dieses Ereignis dokumentiert die echte Wiederaufnahme.",
    "Kein neuer Gesellschafts-, Vertrags- oder Rechtsbefund."
  ]
}
